{
  "schema": "mypybite.signal-pipeline-state.v1",
  "pipelineVersion": 1,
  "updatedAt": "2026-10-24T00:00:47Z",
  "candidates": {
    "sec:0000004962-26-000409:0000004962": {
      "pipelineVersion": 1,
      "status": "quarantined",
      "accessionNumber": "0000004962-26-000409",
      "cik": "0000004962",
      "completedAt": "2026-10-23T17:22:59Z",
      "stage": "publication-gate",
      "reasons": [
        "Who, What, When and How must be source-supported; undisclosed Why or Where must be explicit.",
        "The category and high-materiality decision must match a defined rule.",
        "Important and Critical events require high confidence; other events require at least moderate confidence.",
        "Automatic publication currently supports Form 8-K and 8-K/A only; other forms require a form-specific reader."
      ],
      "eventId": null
    },
    "sec:0001193125-26-429539:0000104169": {
      "pipelineVersion": 1,
      "status": "quarantined",
      "accessionNumber": "0001193125-26-429539",
      "cik": "0000104169",
      "completedAt": "2026-10-23T17:22:59Z",
      "stage": "publication-gate",
      "reasons": [
        "The event must name a concrete disclosed action without filing boilerplate.",
        "Important and Critical events require high confidence; other events require at least moderate confidence.",
        "Reader text must not contain hype, trade instructions, or price predictions."
      ],
      "eventId": null
    },
    "sec:0001193125-26-429435:0000087347": {
      "pipelineVersion": 1,
      "status": "auto-approved",
      "accessionNumber": "0001193125-26-429435",
      "cik": "0000087347",
      "completedAt": "2026-10-23T17:22:59Z",
      "stage": "publication-gate",
      "reasons": [],
      "eventId": "sec:0001193125-26-429435:15d5adc2622e"
    },
    "sec:0000004962-26-000405:0000004962": {
      "pipelineVersion": 1,
      "status": "quarantined",
      "accessionNumber": "0000004962-26-000405",
      "cik": "0000004962",
      "completedAt": "2026-10-23T17:22:59Z",
      "stage": "publication-gate",
      "reasons": [
        "An explicitly dated action must be current enough to represent a development in the newly filed statement."
      ],
      "eventId": null
    },
    "sec:0001193125-26-429267:0000059478": {
      "pipelineVersion": 1,
      "status": "quarantined",
      "accessionNumber": "0001193125-26-429267",
      "cik": "0000059478",
      "completedAt": "2026-10-23T17:22:59Z",
      "stage": "publication-gate",
      "reasons": [
        "Who, What, When and How must be source-supported; undisclosed Why or Where must be explicit.",
        "Important and Critical events require high confidence; other events require at least moderate confidence.",
        "Automatic publication currently supports Form 8-K and 8-K/A only; other forms require a form-specific reader.",
        "The selected passage must state a concrete corporate action and must not be filing instructions or regulatory boilerplate."
      ],
      "eventId": null
    },
    "sec:0000829224-26-000149:0000829224": {
      "pipelineVersion": 1,
      "status": "quarantined",
      "accessionNumber": "0000829224-26-000149",
      "cik": "0000829224",
      "completedAt": "2026-10-23T17:22:59Z",
      "stage": "publication-gate",
      "reasons": [
        "Who, What, When and How must be source-supported; undisclosed Why or Where must be explicit.",
        "Important and Critical events require high confidence; other events require at least moderate confidence.",
        "Automatic publication currently supports Form 8-K and 8-K/A only; other forms require a form-specific reader.",
        "The selected passage must state a concrete corporate action and must not be filing instructions or regulatory boilerplate."
      ],
      "eventId": null
    },
    "sec:0001140361-26-040540:0000320193": {
      "pipelineVersion": 1,
      "status": "quarantined",
      "accessionNumber": "0001140361-26-040540",
      "cik": "0000320193",
      "completedAt": "2026-10-23T17:22:59Z",
      "stage": "publication-gate",
      "reasons": [
        "Who, What, When and How must be source-supported; undisclosed Why or Where must be explicit.",
        "Important and Critical events require high confidence; other events require at least moderate confidence.",
        "Automatic publication currently supports Form 8-K and 8-K/A only; other forms require a form-specific reader.",
        "The selected passage must state a concrete corporate action and must not be filing instructions or regulatory boilerplate."
      ],
      "eventId": null
    },
    "sec:0001104659-26-118193:0000831001": {
      "pipelineVersion": 1,
      "status": "quarantined",
      "accessionNumber": "0001104659-26-118193",
      "cik": "0000831001",
      "completedAt": "2026-10-23T17:22:59Z",
      "stage": "publication-gate",
      "reasons": [
        "Who, What, When and How must be source-supported; undisclosed Why or Where must be explicit.",
        "Important and Critical events require high confidence; other events require at least moderate confidence."
      ],
      "eventId": null
    },
    "sec:0001628280-26-066928:0000936468": {
      "pipelineVersion": 1,
      "status": "quarantined",
      "accessionNumber": "0001628280-26-066928",
      "cik": "0000936468",
      "completedAt": "2026-10-23T17:22:59Z",
      "stage": "publication-gate",
      "reasons": [
        "Who, What, When and How must be source-supported; undisclosed Why or Where must be explicit.",
        "Important and Critical events require high confidence; other events require at least moderate confidence.",
        "Automatic publication currently supports Form 8-K and 8-K/A only; other forms require a form-specific reader.",
        "The selected passage must state a concrete corporate action and must not be filing instructions or regulatory boilerplate."
      ],
      "eventId": null
    },
    "sec:0001593123-26-000007:0001375365": {
      "pipelineVersion": 1,
      "status": "quarantined",
      "accessionNumber": "0001593123-26-000007",
      "cik": "0001375365",
      "completedAt": "2026-10-23T17:22:59Z",
      "stage": "publication-gate",
      "reasons": [
        "Who, What, When and How must be source-supported; undisclosed Why or Where must be explicit.",
        "Important and Critical events require high confidence; other events require at least moderate confidence.",
        "Automatic publication currently supports Form 8-K and 8-K/A only; other forms require a form-specific reader.",
        "The selected passage must state a concrete corporate action and must not be filing instructions or regulatory boilerplate."
      ],
      "eventId": null
    },
    "sec:0000070858-26-000500:0000070858": {
      "pipelineVersion": 1,
      "status": "quarantined",
      "accessionNumber": "0000070858-26-000500",
      "cik": "0000070858",
      "completedAt": "2026-10-23T17:22:59Z",
      "stage": "publication-gate",
      "reasons": [
        "Who, What, When and How must be source-supported; undisclosed Why or Where must be explicit.",
        "Important and Critical events require high confidence; other events require at least moderate confidence.",
        "Automatic publication currently supports Form 8-K and 8-K/A only; other forms require a form-specific reader.",
        "The selected passage must state a concrete corporate action and must not be filing instructions or regulatory boilerplate."
      ],
      "eventId": null
    },
    "sec:0001493152-26-047950:0001507605": {
      "pipelineVersion": 1,
      "status": "quarantined",
      "accessionNumber": "0001493152-26-047950",
      "cik": "0001507605",
      "completedAt": "2026-10-23T17:22:59Z",
      "stage": "publication-gate",
      "reasons": [
        "Who, What, When and How must be source-supported; undisclosed Why or Where must be explicit.",
        "Important and Critical events require high confidence; other events require at least moderate confidence.",
        "Automatic publication currently supports Form 8-K and 8-K/A only; other forms require a form-specific reader.",
        "The selected passage must state a concrete corporate action and must not be filing instructions or regulatory boilerplate."
      ],
      "eventId": null
    },
    "sec:0000950103-26-015980:0001326801": {
      "pipelineVersion": 1,
      "status": "quarantined",
      "accessionNumber": "0000950103-26-015980",
      "cik": "0001326801",
      "completedAt": "2026-10-23T17:22:59Z",
      "stage": "publication-gate",
      "reasons": [
        "Who, What, When and How must be source-supported; undisclosed Why or Where must be explicit.",
        "Important and Critical events require high confidence; other events require at least moderate confidence.",
        "Automatic publication currently supports Form 8-K and 8-K/A only; other forms require a form-specific reader.",
        "The selected passage must state a concrete corporate action and must not be filing instructions or regulatory boilerplate."
      ],
      "eventId": null
    },
    "sec:0001035267-26-000071:0001035267": {
      "pipelineVersion": 1,
      "status": "quarantined",
      "accessionNumber": "0001035267-26-000071",
      "cik": "0001035267",
      "completedAt": "2026-10-23T17:22:59Z",
      "stage": "publication-gate",
      "reasons": [
        "Who, What, When and How must be source-supported; undisclosed Why or Where must be explicit.",
        "Important and Critical events require high confidence; other events require at least moderate confidence.",
        "Automatic publication currently supports Form 8-K and 8-K/A only; other forms require a form-specific reader.",
        "An explicitly dated action must be current enough to represent a development in the newly filed statement."
      ],
      "eventId": null
    },
    "sec:0002160181-26-000004:0001375365": {
      "pipelineVersion": 1,